{
  "schema_version": "reviewed_metrics_gold_review_authority_v2.0.0",
  "status": "blank_external_review_required",
  "candidate_id": "dfv0_reviewed_metrics_v2_candidate_20260715",
  "bundle_tree_sha256": null,
  "reviewer": null,
  "reviews": [],
  "required_opaque_ids": [
    "v2-0001",
    "v2-0002",
    "v2-0003",
    "v2-0004",
    "v2-0005",
    "v2-0006",
    "v2-0007",
    "v2-0008",
    "v2-0009",
    "v2-0010",
    "v2-0011",
    "v2-0012",
    "v2-0013",
    "v2-0014",
    "v2-0015",
    "v2-0016",
    "v2-0017",
    "v2-0018",
    "v2-0019",
    "v2-0020",
    "v2-0021",
    "v2-0022",
    "v2-0023",
    "v2-0024",
    "v2-0025",
    "v2-0026",
    "v2-0027",
    "v2-0028",
    "v2-0029",
    "v2-0030",
    "v2-0031",
    "v2-0032",
    "v2-0033",
    "v2-0034",
    "v2-0035",
    "v2-0036",
    "v2-0037",
    "v2-0038",
    "v2-0039",
    "v2-0040",
    "v2-0041",
    "v2-0042",
    "v2-0043",
    "v2-0044"
  ],
  "reviewed_exclusions": []
}
